{
  "$schema": "https://json-schema.org/draft/2020-12/schema",
  "$id": "https://careloop.example/contracts/atlas-task-artifact/1.0",
  "title": "Atlas Task Artifact",
  "type": "object",
  "additionalProperties": false,
  "required": ["contractVersion", "taskId", "incidentId", "chairId", "capability", "status", "observations", "patientStatements", "evidenceRefs", "completedAt", "provenance"],
  "properties": {
    "contractVersion": { "type": "string", "const": "1.0" },
    "taskId": { "type": "string", "pattern": "^task-[a-z0-9-]+$" },
    "incidentId": { "type": "string", "pattern": "^incident-[a-z0-9-]+$" },
    "chairId": { "type": "string", "enum": ["chair-01", "chair-02", "chair-03", "chair-04"] },
    "capability": { "type": "string", "enum": ["deliver_item", "collect_vital_sign", "observe_patient", "ask_patient"] },
    "status": { "type": "string", "enum": ["completed", "unable", "human_help_required"] },
    "summary": { "type": "string", "maxLength": 500 },
    "observations": { "type": "array", "items": { "type": "object" } },
    "patientStatements": { "type": "array", "items": { "type": "string" } },
    "evidenceRefs": { "type": "array", "items": { "type": "string", "minLength": 1 }, "minItems": 1, "uniqueItems": true },
    "completedAt": { "type": "string", "format": "date-time" },
    "provenance": {
      "type": "object",
      "additionalProperties": false,
      "required": ["source", "sourceType", "capturedAt"],
      "properties": {
        "source": { "type": "string", "const": "atlas-simulator" },
        "sourceType": { "type": "string", "const": "simulated" },
        "capturedAt": { "type": "string", "format": "date-time" }
      }
    }
  }
}
